<?xml version="1.0" encoding="utf-8"?>
<feed xmlns="http://www.w3.org/2005/Atom">
    <title>Duck's Cry</title>
    <link href="https://dukzcry.github.io/atom.xml" rel="self" />
    <link href="https://dukzcry.github.io" />
    <id>https://dukzcry.github.io/atom.xml</id>
    <author>
        <name>Artem Lukyanov</name>
        
        <email>dukzcry@ya.ru</email>
        
    </author>
    <updated>2021-09-17T00:00:00Z</updated>
    <entry>
    <title>Домашний сервер</title>
    <link href="https://dukzcry.github.io/posts/server.html" />
    <id>https://dukzcry.github.io/posts/server.html</id>
    <published>17.09.2021</published>
    <updated>2021-09-17T00:00:00Z</updated>
    <summary type="html"><![CDATA[<p>
<a href="/posts/server.html">Домашний сервер</a>
<br />
17 сентября 2021

    написал dukzcry

</p>
<p>Понадобилось собрать домашний сервер для различных гедонистических целей. Как можно заметить на фото ниже, данный сервер и сопутствующие причиндалы уютно разместились на бабушкиной антресоли:</p>
<p><span class="math inline">

<a href="/gallery/server/photo1681667758.jpeg.html"><img src="/gallery/server/photo1681667758.thumb.jpeg"/></a>
<link rel="prefetch" href="/gallery/server/photo1681667758.jpeg">



<a href="/gallery/server/photo1681667759.jpeg.html"><img src="/gallery/server/photo1681667759.thumb.jpeg"/></a>
<link rel="prefetch" href="/gallery/server/photo1681667759.jpeg">


</span></p>
<p>В качестве компонентов были выбраны следующие железки:</p>
<ul>
<li>Платформа ASRock DeskMini X300. Подкупили форм-фактор Mini-STX и возможности расширения: 1 укороченный и 2 полноразмерных слота M.2, а также 2 отсека для 2.5” дисков</li>
<li>Процессор AMD Ryzen 5 3400G, пока устраивает</li>
<li>16 Гб ОЗУ от Kingston, пока хватает</li>
<li>256 Гб Samsung PM961 SSD под систему. Вынул из своего ноута, пока работает</li>
<li>2 Тб винт от Western Digital под данные, поскольку нет требования к скорости диска. В дальнейшем планируется по необходимости наращивать количество накопителей</li>
</ul>
<p>Из сопутствующего:</p>
<ul>
<li>Трофейный ИБП Ippon Back Power Pro LCD 600, аккумулятор пришлось менять</li>
<li>Старый принтер Xerox Phaser 3116, он же Samsung ML-1520. Родителям купил новый беспроводной принтер, а себе забрал старичка</li>
</ul>
<p>Наиболее затруднительным моментом стал подбор Wi-FI адаптеров для работы в режиме точки доступа. Для сети стандарта 802.11n (для поддержки устаревших устройств) выбор пал на дешёвый USB-свисток с Ali на чипе AR9271, поддерживаемый старым добрым драйвером ath9k, граалем всех борцов за свободное ПО. Для более современной сети, просмотрев цены и возможности разных адаптеров, я выбрал QCA6174 формата M.2, поддерживаемый богомерзким драйвером ath10k. Дело, на самом деле, вовсе не в драйвере, а в закрытой прошивке. Данный адаптер за 500р развивает ту же цифру скорости в 500 Мбит/с. К сожалению, стандарт у него лишь 802.11ac, и более высокие скорости ему не снились. Но этого более-менее достаточно для вещания игр и кино на телик и проектор. Я пробовал более современный адаптер 802.11ax MT7921, встроенный в материнку моего настольного компа, но к сожалению, в режиме работы 802.11ac он показал намного меньшие скорости, нежели QCA6174, да и по деньгам он был бы дороже.<br />
Но просто установить адаптер оказалось недостаточным, пришлось ещё обойти некие региональные ограничения для работы адаптера в режиме токи в диапазоне пятигигагерцовых сетей. К счастью, для драйвера ath10k у проекта OpenWRT оказался патч снимающий данные региональные ограничения. Патч так же доступен через опцию <code>networking.wireless.athUserRegulatoryDomain</code> в дистрибутиве NixOS, который я использую.<br />
Зачем вообще мне понадобилось делать программные точки доступа? Для удобства руления ими через единый конфиг NixOS’а. Ну и просто потому, что собирать свой зюзероутер - добрая традиция линуксоидов.</p>
<p>Небольшой вишенкой на торте стала HDMI-затычка с Ali, эмулирующая присутствие монитора. Что позволяет передавать картинку от графического сервера без использования программных костылей. Пусть лучше будет костыль аппаратный 🙂</p>
<p>Далее перечислены задачи, которые в данный момент решает сервер. Поскольку я использую любимицу девопсов и функциональных программистов NixOS, под некоторыми пунктами буду делиться своими полезными модулями для NUR, реализующими соответствующий функционал:</p>
<ul>
<li>Роутер и Wi-Fi точка доступа<br />
<a href="https://github.com/repos-holder/nur-packages/tree/master/modules/hostapd">hostapd</a>. Модуль позволяет создать N точек доступа на hostapd в дополнение к основной</li>
<li>Обход РКН<br />
<a href="https://github.com/repos-holder/nur-packages/blob/master/modules/rkn.nix">rkn</a>. Модуль реализует обход ограничений роскомпозора. Используемое ПО nginx и dnsmasq</li>
<li>Файлопомойка</li>
<li>Торрент-клиент</li>
<li>Медиа-сервер</li>
<li>Виртуализация. <em>Не особо актуально, поскольку на основном компе под это дело памяти и процессорной мощи в разы больше</em></li>
<li>Стриминг игр на другие устройства<br />
<a href="https://github.com/repos-holder/nur-packages/blob/master/modules/headless.nix">headless</a>. Модуль реализует «безголовый» графический сервер<br />
<a href="https://github.com/repos-holder/nur-packages/blob/master/modules/sunshine.nix">sunshine</a>. Модуль для правильной установки ПО Sunshine. На клиент, например телевизор, устанавливаем клиент Moonlight</li>
<li>Мониторинг</li>
<li>VPN<br />
<a href="https://github.com/repos-holder/nur-packages/blob/master/modules/edgevpn.nix">edgevpn</a>. Модуль, реализующий VPN сервер и клиент. Не требует публичного IP адреса</li>
<li>Git</li>
<li>Синхронизация файлов</li>
<li>Веб-панель<br />
<a href="https://github.com/repos-holder/nur-packages/blob/master/modules/cockpit.nix">cockpit</a>. Редхатовский современный аналог webmin<br />
<a href="https://github.com/repos-holder/nur-packages/blob/master/pkgs/homer.nix">homer</a>. Пакет с веб-панелью для домашних серверов, отображающей карточки различных сервисов</li>
<li><del>Сборочная ферма</del>. Данный функционал перенёс на основной комп</li>
<li>Принт-сервер</li>
<li><del>Блокировщик рекламы</del>. По результатам оказалось, что лучше это делать на клиентской стороне</li>
</ul>
<p>
    
      категории <a title="All pages tagged &#39;сервер&#39;." href="/tags/%D1%81%D0%B5%D1%80%D0%B2%D0%B5%D1%80.html" rel="tag">сервер</a>, <a title="All pages tagged &#39;nixos&#39;." href="/tags/nixos.html" rel="tag">nixos</a>, <a title="All pages tagged &#39;linux&#39;." href="/tags/linux.html" rel="tag">linux</a>
    
    <span class="disqus-comment-count" data-disqus-identifier="posts/server.md"></span>
</p>
]]></summary>
</entry>
<entry>
    <title>Дачный ретрокомп</title>
    <link href="https://dukzcry.github.io/posts/retropc.html" />
    <id>https://dukzcry.github.io/posts/retropc.html</id>
    <published>19.07.2021</published>
    <updated>2021-07-19T00:00:00Z</updated>
    <summary type="html"><![CDATA[<p>
<a href="/posts/retropc.html">Дачный ретрокомп</a>
<br />
19 июля 2021

    написал dukzcry

</p>
<p>Так получилось, что моим первым компьютером стал системный блок с Pentium II. Это была интересная эпоха - процессор в виде картриджа и щелевой разъём на материнке под него, культовые видеоускорители 3dfx, аудиокарты с таблично-волновым синтезом, материнские платы уже с разъёмом AGP, но всё ещё не избавившиеся от ISA слотов.<br />
Я испытываю сильную ностальгию по тем временам. Однако, я не стал воспроизводить в точности конфигурацию того компьютера, а собрал нечто по его мотивам. Так, под нож пошли форм-фактор AT, разъём клавиатуры DIN5, COM-мышка. Вместо этого была собрана система стандарта ATX, с PS/2 мышью, клавой и USB портами. Также были выбраны максимально дешёвые компоненты, поскольку это дачный редко используемый компьютер. Опять же не было никакого желания сидеть месяцами на сайтах барахолок в поисках халявы и вгрызаться в глотки коллекционерам.<br />
Для проверки софта и игр под данную платформу рекомендую эмулятор 86Box, однако для его запуска потребуется достаточно мощный комп.</p>
<p><span class="math inline">

<a href="/gallery/retropc/IMG_20230429_132633.jpg.html"><img src="/gallery/retropc/IMG_20230429_132633.thumb.jpg"/></a>
<link rel="prefetch" href="/gallery/retropc/IMG_20230429_132633.jpg">



<a href="/gallery/retropc/IMG_20230430_090319.jpg.html"><img src="/gallery/retropc/IMG_20230430_090319.thumb.jpg"/></a>
<link rel="prefetch" href="/gallery/retropc/IMG_20230430_090319.jpg">


</span></p>
<p>Итак, что можно собрать:</p>
<ul>
<li>Процессор<br />
Цена: 500р<br />
Если важна универсальность, то берём Pentium II с разблокированным множителем, что позволит менять частоту процессора. Определить разблокирован ли множитель можно по номеру на картридже. Вторая цифра означает последнюю цифру года, третья и чётвёртая - неделю изготовления. Процессор должен быть изготовлен до 34 недели 98 года<br />
Если нужна максимальная скорость, то можно брать слотовый Pentium III. За такую цену это будут процессоры с частотой 500-600 МГц. Процессоры 800 МГц и выше редки и дороги</li>
<li>Материнская плата<br />
Цена: 1000-2000р<br />
Можно приобрести плату стандарта ATX на культовом чипсете 440BX, с набортными USB и PS/2. Желательно с Plug &amp; Play BIOS’ом, чтобы можно было выставлять настройки процессора программно, без джамперов<br />
В случае выбора данного чипсета стоит с вниманием отнестись к подбору процессора, видеокарты и памяти. Так, штатная частота системной шины у данного чипсета - 100 МГц. В случае разгона по шине стоит выбирать видеокарту от Nvidia, т.к. AMD не переваривает последующее за разгоном повышение частоты AGP. Память плотностью 256 Мб на планку должна быть двухсторонней</li>
<li>Оперативная память<br />
Цена: зависит от объёма<br />
Для девяностовосьмёрки нет необходимости брать больше 512 Мб</li>
<li>Видеокарта<br />
Цена: 300-500р<br />
Любая AGP карта с 3.3 В разъёмом, либо универсальная</li>
<li>SATA контроллер<br />
Цена: 300-500р<br />
Полезная опция. Дешевые варианты это Silicon Image 3112/3512. TRIM работать не будет, в остальном неплохая вещь</li>
<li>SSD диск<br />
Цена: 1000р за новый на 120 Гб<br />
Под 98 винду можно смело брать на 120 Гб, если больше - могут быть проблемы, а меньше теперь, как правило, и не продают</li>
<li>Сетевая карта<br />
Цена: 500р<br />
Беспроводной адаптер TP-LINK TL-WN651G стандарта 802.11g имеет драйвера под Windows 98, и даже работает</li>
<li>Звуковая карта<br />
Цена: 300-500р<br />
Любая для слота ISA, неважно Plug &amp; Play или нет, но лучше чтобы настройки выставлялись программно, а не перемычками. Если получится, то лучше взять аудиокарту с родным чипом Yamaha OPL для качественного FM-синтеза в DOS играх</li>
<li>USB 2.0 контроллер<br />
Цена: 100р<br />
Есть смысл поставить для увеличения количества USB слотов и повышения скорости передачи данных, поскольку на материнках той эпохи был лишь медленный USB 1.1. Хорошо будет работать карта на чипе NEC D720100AGM</li>
<li>CD-RW дисковод<br />
Цена: 300р<br />
Подойдёт старенький пишущий дисковод для шины IDE</li>
</ul>
<p>
    
      категории <a title="All pages tagged &#39;ретрокомпьютер&#39;." href="/tags/%D1%80%D0%B5%D1%82%D1%80%D0%BE%D0%BA%D0%BE%D0%BC%D0%BF%D1%8C%D1%8E%D1%82%D0%B5%D1%80.html" rel="tag">ретрокомпьютер</a>, <a title="All pages tagged &#39;slot1&#39;." href="/tags/slot1.html" rel="tag">slot1</a>
    
    <span class="disqus-comment-count" data-disqus-identifier="posts/retropc.md"></span>
</p>
]]></summary>
</entry>
<entry>
    <title>Книги которые взорвали мозг</title>
    <link href="https://dukzcry.github.io/posts/books.html" />
    <id>https://dukzcry.github.io/posts/books.html</id>
    <published>18.01.2021</published>
    <updated>2021-01-18T00:00:00Z</updated>
    <summary type="html"><![CDATA[<p>
<a href="/posts/books.html">Книги которые взорвали мозг</a>
<br />
18 января 2021

    написал dukzcry

</p>
<ul>
<li>Чайна Мьевиль «Вокзал потерянных снов»</li>
<li>Говард Лакврафт «Сомнамбулический поиск неведомого Кадата»</li>
<li>Майкл Суэнвик «Дочь железного дракона»</li>
<li>Дон Делилло «Белый шум»</li>
<li>Джефф Нун «Брошенные машины»</li>
<li>Иван Братко «Программирование на языке Пролог для искусственного интеллекта» <em>(внезапно)</em></li>
<li>Элиезер Юдковский «Гарри Поттер и методы рационального мышления»</li>
<li>Эдвин Э. Эбботт «Флатландия»</li>
</ul>
<p>
    
      категории <a title="All pages tagged &#39;книги&#39;." href="/tags/%D0%BA%D0%BD%D0%B8%D0%B3%D0%B8.html" rel="tag">книги</a>
    
    <span class="disqus-comment-count" data-disqus-identifier="posts/books.md"></span>
</p>
]]></summary>
</entry>
<entry>
    <title>Германия</title>
    <link href="https://dukzcry.github.io/posts/germany.html" />
    <id>https://dukzcry.github.io/posts/germany.html</id>
    <published>16.11.2019</published>
    <updated>2019-11-16T00:00:00Z</updated>
    <summary type="html"><![CDATA[<p>
<a href="/posts/germany.html">Германия</a>
<br />
16 ноября 2019

    написал dukzcry

</p>
<p>Съездил в Берлин. Фотоотчет присутствует.</p>
<p><span class="math inline">

<a href="/gallery/germany/IMG_20191109_204239.jpg.html"><img src="/gallery/germany/IMG_20191109_204239.thumb.jpg"/></a>
<link rel="prefetch" href="/gallery/germany/IMG_20191109_204239.jpg">



<a href="/gallery/germany/IMG_20191110_123635.jpg.html"><img src="/gallery/germany/IMG_20191110_123635.thumb.jpg"/></a>
<link rel="prefetch" href="/gallery/germany/IMG_20191110_123635.jpg">



<a href="/gallery/germany/IMG_20191110_164656.jpg.html"><img src="/gallery/germany/IMG_20191110_164656.thumb.jpg"/></a>
<link rel="prefetch" href="/gallery/germany/IMG_20191110_164656.jpg">



<a href="/gallery/germany/IMG_20191110_172042.jpg.html"><img src="/gallery/germany/IMG_20191110_172042.thumb.jpg"/></a>
<link rel="prefetch" href="/gallery/germany/IMG_20191110_172042.jpg">



<a href="/gallery/germany/IMG_20191110_174337.jpg.html"><img src="/gallery/germany/IMG_20191110_174337.thumb.jpg"/></a>
<link rel="prefetch" href="/gallery/germany/IMG_20191110_174337.jpg">


</span></p>
<p>
    
      категории <a title="All pages tagged &#39;путешествия&#39;." href="/tags/%D0%BF%D1%83%D1%82%D0%B5%D1%88%D0%B5%D1%81%D1%82%D0%B2%D0%B8%D1%8F.html" rel="tag">путешествия</a>
    
    <span class="disqus-comment-count" data-disqus-identifier="posts/germany.md"></span>
</p>
]]></summary>
</entry>
<entry>
    <title>Слушаем и скробблим трекерную музыку</title>
    <link href="https://dukzcry.github.io/posts/mod.html" />
    <id>https://dukzcry.github.io/posts/mod.html</id>
    <published>22.11.2017</published>
    <updated>2017-11-22T00:00:00Z</updated>
    <summary type="html"><![CDATA[<p>
<a href="/posts/mod.html">Слушаем и скробблим трекерную музыку</a>
<br />
22 ноября 2017

    написал dukzcry

</p>
<blockquote>
<p>Забудьте про ручное тэгирование модулей в XMPlay ради скробблинга!</p>
</blockquote>
<p><a href="https://github.com/dukzcry/crap/tree/master/modplay">Скрипт</a> подходит для прослушивания амижных и писишных трекерных модулей. Используются движки <a href="http://zakalwe.fi/uade/">UADE</a> и <a href="https://lib.openmpt.org/libopenmpt/">libopenmpt</a> От чудесного <a href="http://www.un4seen.com/bass.html">BASS</a> пришлось отказаться по причине небольшого числа поддерживаемых форматов. Впрочем, по заверениям экспертов, libopenmpt очень неплох в плане точности воспроизведения. А еще говорят, что <a href="http://xmp.sourceforge.net/">XMP</a> исправляется.</p>
<p>Музыку в архивах играть мы тоже могем. А вкупе с curlftpfs и модули качать не надо:</p>
<div class="sourceCode" id="cb1"><pre class="sourceCode sh"><code class="sourceCode bash"><span id="cb1-1"><a href="#cb1-1" aria-hidden="true" tabindex="-1"></a><span class="ex">curlftpfs</span> ftp://ftp.scene.org/pub/music/artists/ ~/Music</span>
<span id="cb1-2"><a href="#cb1-2" aria-hidden="true" tabindex="-1"></a><span class="ex">modplay.sh</span> <span class="st">&quot;4-mat&quot;</span> ~/Music/4-mat/<span class="pp">*</span></span></code></pre></div>
<p>
    
      категории <a title="All pages tagged &#39;demoscene&#39;." href="/tags/demoscene.html" rel="tag">demoscene</a>, <a title="All pages tagged &#39;lastfm&#39;." href="/tags/lastfm.html" rel="tag">lastfm</a>, <a title="All pages tagged &#39;mod&#39;." href="/tags/mod.html" rel="tag">mod</a>, <a title="All pages tagged &#39;tracker&#39;." href="/tags/tracker.html" rel="tag">tracker</a>
    
    <span class="disqus-comment-count" data-disqus-identifier="posts/mod.md"></span>
</p>
]]></summary>
</entry>
<entry>
    <title>Хорватия</title>
    <link href="https://dukzcry.github.io/posts/croatia.html" />
    <id>https://dukzcry.github.io/posts/croatia.html</id>
    <published>22.07.2008</published>
    <updated>2008-07-22T00:00:00Z</updated>
    <summary type="html"><![CDATA[<p>
<a href="/posts/croatia.html">Хорватия</a>
<br />
22 июля 2008

    написал dukzcry

</p>
<p><span class="math inline">

<a href="/gallery/croatia/IMG_20210308_0001.jpg.html"><img src="/gallery/croatia/IMG_20210308_0001.thumb.jpg"/></a>
<link rel="prefetch" href="/gallery/croatia/IMG_20210308_0001.jpg">



<a href="/gallery/croatia/IMG_20210308_0002.jpg.html"><img src="/gallery/croatia/IMG_20210308_0002.thumb.jpg"/></a>
<link rel="prefetch" href="/gallery/croatia/IMG_20210308_0002.jpg">



<a href="/gallery/croatia/IMG_20210308_0003.jpg.html"><img src="/gallery/croatia/IMG_20210308_0003.thumb.jpg"/></a>
<link rel="prefetch" href="/gallery/croatia/IMG_20210308_0003.jpg">



<a href="/gallery/croatia/IMG_20210308_0004.jpg.html"><img src="/gallery/croatia/IMG_20210308_0004.thumb.jpg"/></a>
<link rel="prefetch" href="/gallery/croatia/IMG_20210308_0004.jpg">



<a href="/gallery/croatia/IMG_20210308_0005.jpg.html"><img src="/gallery/croatia/IMG_20210308_0005.thumb.jpg"/></a>
<link rel="prefetch" href="/gallery/croatia/IMG_20210308_0005.jpg">


</span></p>
<p>
    
      категории <a title="All pages tagged &#39;путешествия&#39;." href="/tags/%D0%BF%D1%83%D1%82%D0%B5%D1%88%D0%B5%D1%81%D1%82%D0%B2%D0%B8%D1%8F.html" rel="tag">путешествия</a>
    
    <span class="disqus-comment-count" data-disqus-identifier="posts/croatia.md"></span>
</p>
]]></summary>
</entry>
<entry>
    <title>Греция</title>
    <link href="https://dukzcry.github.io/posts/greece.html" />
    <id>https://dukzcry.github.io/posts/greece.html</id>
    <published>01.06.2007</published>
    <updated>2007-06-01T00:00:00Z</updated>
    <summary type="html"><![CDATA[<p>
<a href="/posts/greece.html">Греция</a>
<br />
 1 июня 2007

    написал dukzcry

</p>
<p><span class="math inline">

<a href="/gallery/greece/IMG_20210308_0001.jpg.html"><img src="/gallery/greece/IMG_20210308_0001.thumb.jpg"/></a>
<link rel="prefetch" href="/gallery/greece/IMG_20210308_0001.jpg">



<a href="/gallery/greece/IMG_20210308_0002.jpg.html"><img src="/gallery/greece/IMG_20210308_0002.thumb.jpg"/></a>
<link rel="prefetch" href="/gallery/greece/IMG_20210308_0002.jpg">



<a href="/gallery/greece/IMG_20210308_0003.jpg.html"><img src="/gallery/greece/IMG_20210308_0003.thumb.jpg"/></a>
<link rel="prefetch" href="/gallery/greece/IMG_20210308_0003.jpg">



<a href="/gallery/greece/IMG_20210308_0004.jpg.html"><img src="/gallery/greece/IMG_20210308_0004.thumb.jpg"/></a>
<link rel="prefetch" href="/gallery/greece/IMG_20210308_0004.jpg">


</span></p>
<p>
    
      категории <a title="All pages tagged &#39;путешествия&#39;." href="/tags/%D0%BF%D1%83%D1%82%D0%B5%D1%88%D0%B5%D1%81%D1%82%D0%B2%D0%B8%D1%8F.html" rel="tag">путешествия</a>
    
    <span class="disqus-comment-count" data-disqus-identifier="posts/greece.md"></span>
</p>
]]></summary>
</entry>
<entry>
    <title>Карелия</title>
    <link href="https://dukzcry.github.io/posts/karelia.html" />
    <id>https://dukzcry.github.io/posts/karelia.html</id>
    <published>01.06.2005</published>
    <updated>2005-06-01T00:00:00Z</updated>
    <summary type="html"><![CDATA[<p>
<a href="/posts/karelia.html">Карелия</a>
<br />
 1 июня 2005

    написал dukzcry

</p>
<p><span class="math inline">

<a href="/gallery/karelia/IMG_20210308_0001.jpg.html"><img src="/gallery/karelia/IMG_20210308_0001.thumb.jpg"/></a>
<link rel="prefetch" href="/gallery/karelia/IMG_20210308_0001.jpg">



<a href="/gallery/karelia/IMG_20210308_0002.jpg.html"><img src="/gallery/karelia/IMG_20210308_0002.thumb.jpg"/></a>
<link rel="prefetch" href="/gallery/karelia/IMG_20210308_0002.jpg">



<a href="/gallery/karelia/IMG_20210308_0003.jpg.html"><img src="/gallery/karelia/IMG_20210308_0003.thumb.jpg"/></a>
<link rel="prefetch" href="/gallery/karelia/IMG_20210308_0003.jpg">



<a href="/gallery/karelia/IMG_20210308_0004.jpg.html"><img src="/gallery/karelia/IMG_20210308_0004.thumb.jpg"/></a>
<link rel="prefetch" href="/gallery/karelia/IMG_20210308_0004.jpg">



<a href="/gallery/karelia/IMG_20210308_0005.jpg.html"><img src="/gallery/karelia/IMG_20210308_0005.thumb.jpg"/></a>
<link rel="prefetch" href="/gallery/karelia/IMG_20210308_0005.jpg">



<a href="/gallery/karelia/IMG_20210308_0006.jpg.html"><img src="/gallery/karelia/IMG_20210308_0006.thumb.jpg"/></a>
<link rel="prefetch" href="/gallery/karelia/IMG_20210308_0006.jpg">



<a href="/gallery/karelia/IMG_20210308_0007.jpg.html"><img src="/gallery/karelia/IMG_20210308_0007.thumb.jpg"/></a>
<link rel="prefetch" href="/gallery/karelia/IMG_20210308_0007.jpg">



<a href="/gallery/karelia/IMG_20210308_0008.jpg.html"><img src="/gallery/karelia/IMG_20210308_0008.thumb.jpg"/></a>
<link rel="prefetch" href="/gallery/karelia/IMG_20210308_0008.jpg">


</span></p>
<p>
    
      категории <a title="All pages tagged &#39;путешествия&#39;." href="/tags/%D0%BF%D1%83%D1%82%D0%B5%D1%88%D0%B5%D1%81%D1%82%D0%B2%D0%B8%D1%8F.html" rel="tag">путешествия</a>
    
    <span class="disqus-comment-count" data-disqus-identifier="posts/karelia.md"></span>
</p>
]]></summary>
</entry>
<entry>
    <title>Англия</title>
    <link href="https://dukzcry.github.io/posts/england.html" />
    <id>https://dukzcry.github.io/posts/england.html</id>
    <published>01.06.2003</published>
    <updated>2003-06-01T00:00:00Z</updated>
    <summary type="html"><![CDATA[<p>
<a href="/posts/england.html">Англия</a>
<br />
 1 июня 2003

    написал dukzcry

</p>
<p><span class="math inline">

<a href="/gallery/england/IMG_20210308_0001.jpg.html"><img src="/gallery/england/IMG_20210308_0001.thumb.jpg"/></a>
<link rel="prefetch" href="/gallery/england/IMG_20210308_0001.jpg">



<a href="/gallery/england/IMG_20210308_0002.jpg.html"><img src="/gallery/england/IMG_20210308_0002.thumb.jpg"/></a>
<link rel="prefetch" href="/gallery/england/IMG_20210308_0002.jpg">



<a href="/gallery/england/IMG_20210308_0003.jpg.html"><img src="/gallery/england/IMG_20210308_0003.thumb.jpg"/></a>
<link rel="prefetch" href="/gallery/england/IMG_20210308_0003.jpg">



<a href="/gallery/england/IMG_20210308_0004.jpg.html"><img src="/gallery/england/IMG_20210308_0004.thumb.jpg"/></a>
<link rel="prefetch" href="/gallery/england/IMG_20210308_0004.jpg">



<a href="/gallery/england/IMG_20210308_0005.jpg.html"><img src="/gallery/england/IMG_20210308_0005.thumb.jpg"/></a>
<link rel="prefetch" href="/gallery/england/IMG_20210308_0005.jpg">


</span></p>
<p>
    
      категории <a title="All pages tagged &#39;путешествия&#39;." href="/tags/%D0%BF%D1%83%D1%82%D0%B5%D1%88%D0%B5%D1%81%D1%82%D0%B2%D0%B8%D1%8F.html" rel="tag">путешествия</a>
    
    <span class="disqus-comment-count" data-disqus-identifier="posts/england.md"></span>
</p>
]]></summary>
</entry>
<entry>
    <title>Латвия</title>
    <link href="https://dukzcry.github.io/posts/latvia.html" />
    <id>https://dukzcry.github.io/posts/latvia.html</id>
    <published>01.06.2001</published>
    <updated>2001-06-01T00:00:00Z</updated>
    <summary type="html"><![CDATA[<p>
<a href="/posts/latvia.html">Латвия</a>
<br />
 1 июня 2001

    написал dukzcry

</p>
<p><span class="math inline">

<a href="/gallery/latvia/IMG_20210308_0001.jpg.html"><img src="/gallery/latvia/IMG_20210308_0001.thumb.jpg"/></a>
<link rel="prefetch" href="/gallery/latvia/IMG_20210308_0001.jpg">



<a href="/gallery/latvia/IMG_20210308_0002.jpg.html"><img src="/gallery/latvia/IMG_20210308_0002.thumb.jpg"/></a>
<link rel="prefetch" href="/gallery/latvia/IMG_20210308_0002.jpg">



<a href="/gallery/latvia/IMG_20210308_0003.jpg.html"><img src="/gallery/latvia/IMG_20210308_0003.thumb.jpg"/></a>
<link rel="prefetch" href="/gallery/latvia/IMG_20210308_0003.jpg">



<a href="/gallery/latvia/IMG_20210308_0004.jpg.html"><img src="/gallery/latvia/IMG_20210308_0004.thumb.jpg"/></a>
<link rel="prefetch" href="/gallery/latvia/IMG_20210308_0004.jpg">



<a href="/gallery/latvia/IMG_20210308_0005.jpg.html"><img src="/gallery/latvia/IMG_20210308_0005.thumb.jpg"/></a>
<link rel="prefetch" href="/gallery/latvia/IMG_20210308_0005.jpg">


</span></p>
<p>
    
      категории <a title="All pages tagged &#39;путешествия&#39;." href="/tags/%D0%BF%D1%83%D1%82%D0%B5%D1%88%D0%B5%D1%81%D1%82%D0%B2%D0%B8%D1%8F.html" rel="tag">путешествия</a>
    
    <span class="disqus-comment-count" data-disqus-identifier="posts/latvia.md"></span>
</p>
]]></summary>
</entry>

</feed>
